{
  "_note": "Pre-tournament seed rosters. Final 26-man squads announced ~late May 2026; refresh via wc2026-scrape after that date.",
  "players": [
    {
      "attribution": null,
      "country": "ARG",
      "image_url": null,
      "name": "Marcos Acuña",
      "number": 8,
      "player_id": "ARG_ACUNA",
      "pre_tournament": true,
      "wikidata_q": "Q17462635"
    },
    {
      "attribution": null,
      "country": "ARG",
      "image_url": null,
      "name": "Rodrigo De Paul",
      "number": 7,
      "player_id": "ARG_DE_PAUL",
      "pre_tournament": true,
      "wikidata_q": "Q6110670"
    },
    {
      "attribution": null,
      "country": "ARG",
      "image_url": null,
      "name": "Ángel Di María",
      "number": 11,
      "player_id": "ARG_DI_MARIA",
      "pre_tournament": true,
      "wikidata_q": "Q251683"
    },
    {
      "attribution": null,
      "country": "ARG",
      "image_url": null,
      "name": "Enzo Fernández",
      "number": 24,
      "player_id": "ARG_E_FERNANDEZ",
      "pre_tournament": true,
      "wikidata_q": "Q96105248"
    },
    {
      "attribution": null,
      "country": "ARG",
      "image_url": null,
      "name": "Emiliano Martínez",
      "number": 23,
      "player_id": "ARG_E_MARTINEZ",
      "pre_tournament": true,
      "wikidata_q": "Q3275904"
    },
    {
      "attribution": null,
      "country": "ARG",
      "image_url": null,
      "name": "Julián Álvarez",
      "number": 9,
      "player_id": "ARG_J_ALVAREZ",
      "pre_tournament": true,
      "wikidata_q": "Q98641810"
    },
    {
      "attribution": null,
      "country": "ARG",
      "image_url": null,
      "name": "Alexis Mac Allister",
      "number": 20,
      "player_id": "ARG_MAC_ALLISTER",
      "pre_tournament": true,
      "wikidata_q": "Q33297140"
    },
    {
      "attribution": null,
      "country": "ARG",
      "image_url": null,
      "name": "Lionel Messi",
      "number": 10,
      "player_id": "ARG_MESSI",
      "pre_tournament": true,
      "wikidata_q": "Q615"
    },
    {
      "attribution": null,
      "country": "ARG",
      "image_url": null,
      "name": "Nahuel Molina",
      "number": 26,
      "player_id": "ARG_MOLINA",
      "pre_tournament": true,
      "wikidata_q": "Q22082590"
    },
    {
      "attribution": null,
      "country": "ARG",
      "image_url": null,
      "name": "Nicolás Otamendi",
      "number": 19,
      "player_id": "ARG_OTAMENDI",
      "pre_tournament": true,
      "wikidata_q": "Q182063"
    },
    {
      "attribution": null,
      "country": "ARG",
      "image_url": null,
      "name": "Cristian Romero",
      "number": 13,
      "player_id": "ARG_ROMERO",
      "pre_tournament": true,
      "wikidata_q": "Q28058687"
    },
    {
      "attribution": null,
      "country": "AUS",
      "image_url": null,
      "name": "Riley McGree",
      "number": 6,
      "player_id": "AUS_ARNOLD",
      "pre_tournament": true,
      "wikidata_q": "Q31096498"
    },
    {
      "attribution": null,
      "country": "AUS",
      "image_url": null,
      "name": "Jackson Irvine",
      "number": 22,
      "player_id": "AUS_IRVINE",
      "pre_tournament": true,
      "wikidata_q": "Q15455061"
    },
    {
      "attribution": null,
      "country": "AUS",
      "image_url": null,
      "name": "Mathew Ryan",
      "number": 1,
      "player_id": "AUS_RYAN",
      "pre_tournament": true,
      "wikidata_q": "Q4140013"
    },
    {
      "attribution": null,
      "country": "BEL",
      "image_url": null,
      "name": "Koen Casteels",
      "number": 1,
      "player_id": "BEL_CASTEELS",
      "pre_tournament": true,
      "wikidata_q": "Q1361858"
    },
    {
      "attribution": null,
      "country": "BEL",
      "image_url": null,
      "name": "Kevin De Bruyne",
      "number": 7,
      "player_id": "BEL_DE_BRUYNE",
      "pre_tournament": true,
      "wikidata_q": "Q367530"
    },
    {
      "attribution": null,
      "country": "BEL",
      "image_url": null,
      "name": "Jérémy Doku",
      "number": 11,
      "player_id": "BEL_DOKU",
      "pre_tournament": true,
      "wikidata_q": "Q60661493"
    },
    {
      "attribution": null,
      "country": "BEL",
      "image_url": null,
      "name": "Romelu Lukaku",
      "number": 9,
      "player_id": "BEL_LUKAKU",
      "pre_tournament": true,
      "wikidata_q": "Q1245533"
    },
    {
      "attribution": null,
      "country": "BRA",
      "image_url": null,
      "name": "Alisson Becker",
      "number": 1,
      "player_id": "BRA_ALISSON",
      "pre_tournament": true,
      "wikidata_q": "Q19828054"
    },
    {
      "attribution": null,
      "country": "BRA",
      "image_url": null,
      "name": "Bruno Guimarães",
      "number": 8,
      "player_id": "BRA_BRUNO_G",
      "pre_tournament": true,
      "wikidata_q": "Q60634443"
    },
    {
      "attribution": null,
      "country": "BRA",
      "image_url": null,
      "name": "Casemiro",
      "number": 5,
      "player_id": "BRA_CASEMIRO",
      "pre_tournament": true,
      "wikidata_q": "Q3499053"
    },
    {
      "attribution": null,
      "country": "BRA",
      "image_url": null,
      "name": "Danilo",
      "number": 2,
      "player_id": "BRA_DANILO",
      "pre_tournament": true,
      "wikidata_q": "Q3251268"
    },
    {
      "attribution": null,
      "country": "BRA",
      "image_url": null,
      "name": "Marquinhos",
      "number": 4,
      "player_id": "BRA_MARQUINHOS",
      "pre_tournament": true,
      "wikidata_q": "Q1438268"
    },
    {
      "attribution": null,
      "country": "BRA",
      "image_url": null,
      "name": "Raphinha",
      "number": 11,
      "player_id": "BRA_RAPHINHA",
      "pre_tournament": true,
      "wikidata_q": "Q23015660"
    },
    {
      "attribution": null,
      "country": "BRA",
      "image_url": null,
      "name": "Rodrygo",
      "number": 9,
      "player_id": "BRA_RODRYGO",
      "pre_tournament": true,
      "wikidata_q": "Q57498611"
    },
    {
      "attribution": null,
      "country": "BRA",
      "image_url": null,
      "name": "Vinicius Jr.",
      "number": 7,
      "player_id": "BRA_VINICIUS",
      "pre_tournament": true,
      "wikidata_q": "Q17451832"
    },
    {
      "attribution": null,
      "country": "CAN",
      "image_url": null,
      "name": "Jonathan David",
      "number": 20,
      "player_id": "CAN_DAVID",
      "pre_tournament": true,
      "wikidata_q": "Q42301731"
    },
    {
      "attribution": null,
      "country": "CAN",
      "image_url": null,
      "name": "Alphonso Davies",
      "number": 19,
      "player_id": "CAN_DAVIES",
      "pre_tournament": true,
      "wikidata_q": "Q31092497"
    },
    {
      "attribution": null,
      "country": "CAN",
      "image_url": null,
      "name": "Mark-Anthony Kaye",
      "number": 14,
      "player_id": "CAN_KAYE",
      "pre_tournament": true,
      "wikidata_q": "Q33129083"
    },
    {
      "attribution": null,
      "country": "CAN",
      "image_url": null,
      "name": "Cyle Larin",
      "number": 17,
      "player_id": "CAN_LARIN",
      "pre_tournament": true,
      "wikidata_q": "Q21080574"
    },
    {
      "attribution": null,
      "country": "CAN",
      "image_url": null,
      "name": "Dayne St. Clair",
      "number": 1,
      "player_id": "CAN_ST_CLAIR",
      "pre_tournament": true,
      "wikidata_q": "Q60728085"
    },
    {
      "attribution": null,
      "country": "COL",
      "image_url": null,
      "name": "Juan Cuadrado",
      "number": 11,
      "player_id": "COL_CUADRADO",
      "pre_tournament": true,
      "wikidata_q": "Q322318"
    },
    {
      "attribution": null,
      "country": "COL",
      "image_url": null,
      "name": "James Rodríguez",
      "number": 10,
      "player_id": "COL_J_RODRIGUEZ",
      "pre_tournament": true,
      "wikidata_q": "Q21737"
    },
    {
      "attribution": null,
      "country": "COL",
      "image_url": null,
      "name": "Jefferson Lerma",
      "number": 8,
      "player_id": "COL_LERMA",
      "pre_tournament": true,
      "wikidata_q": "Q21193275"
    },
    {
      "attribution": null,
      "country": "CRO",
      "image_url": null,
      "name": "Mateo Kovačić",
      "number": 8,
      "player_id": "CRO_KOVACIC",
      "pre_tournament": true,
      "wikidata_q": "Q1356420"
    },
    {
      "attribution": null,
      "country": "CRO",
      "image_url": null,
      "name": "Dominik Livaković",
      "number": 1,
      "player_id": "CRO_LIVAKOVIC",
      "pre_tournament": true,
      "wikidata_q": "Q21058174"
    },
    {
      "attribution": null,
      "country": "CRO",
      "image_url": null,
      "name": "Luka Modrić",
      "number": 10,
      "player_id": "CRO_MODRIC",
      "pre_tournament": true,
      "wikidata_q": "Q102447"
    },
    {
      "attribution": null,
      "country": "CRO",
      "image_url": null,
      "name": "Ivan Perišić",
      "number": 4,
      "player_id": "CRO_PERISIC",
      "pre_tournament": true,
      "wikidata_q": "Q1378443"
    },
    {
      "attribution": null,
      "country": "ECU",
      "image_url": null,
      "name": "Moisés Caicedo",
      "number": 23,
      "player_id": "ECU_CAICEDO",
      "pre_tournament": true,
      "wikidata_q": "Q98056022"
    },
    {
      "attribution": null,
      "country": "ECU",
      "image_url": null,
      "name": "Pervis Estupiñán",
      "number": 7,
      "player_id": "ECU_ESTUPINAN",
      "pre_tournament": true,
      "wikidata_q": "Q22674094"
    },
    {
      "attribution": null,
      "country": "ECU",
      "image_url": null,
      "name": "Enner Valencia",
      "number": 13,
      "player_id": "ECU_E_VALENCIA",
      "pre_tournament": true,
      "wikidata_q": "Q1357829"
    },
    {
      "attribution": null,
      "country": "EGY",
      "image_url": null,
      "name": "Mohamed El-Shenawy",
      "number": 1,
      "player_id": "EGY_EL_SHENAWY",
      "pre_tournament": true,